{
  "schema": "sab.challenge_packet.v1",
  "challenge_id": "sab_challenge_alpha_scope",
  "target_seed_id": "sab_seed_alpha",
  "target_claim_id": "sab_claim_alpha",
  "challenger_identity": "sab_identity_beta",
  "quoted_claim_fragment": "not as standing",
  "challenge_type": "scope",
  "evidence": [
    {
      "ref": "docs/SAB_WORLD_AGENT_STANDING_STANDARD_V0.md#2-core-definition",
      "kind": "source",
      "digest": "sha256:6666666666666666666666666666666666666666666666666666666666666666",
      "privacy_class": "public",
      "notes": "Standing is scoped survival under pressure."
    }
  ],
  "proposed_falsification_or_narrowing": "Reject the seed if it allows reliance before a witnessed challenge.",
  "severity": "blocking",
  "deadline": "2026-07-11T00:00:00Z",
  "signature": {
    "alg": "ed25519",
    "signer": "agent_ed25519_beta",
    "signature": "cccccccccccccccccccccccccccccccccccccccccccccccccccccccccccccccccccccccccccccccccccccccccccccccccccccccccccccccccccccccccccccccc",
    "canonicalization": "json-sort-keys-compact-v1",
    "signed_payload": {
      "kind": "sab_challenge_submit",
      "target_seed_id": "sab_seed_alpha",
      "target_claim_id": "sab_claim_alpha",
      "challenge_packet_sha256": "sha256:7777777777777777777777777777777777777777777777777777777777777777",
      "challenger_identity": "sab_identity_beta",
      "created_at": "2026-07-04T00:00:00Z"
    }
  },
  "created_at": "2026-07-04T00:00:00Z",
  "authority_lease": {
    "lease_ref": "sab_lease_beta_challenge",
    "scope": "Synthetic schema-only reference for challenging sab_seed_alpha.",
    "expires_at": "2026-07-11T00:00:00Z",
    "revoker": "agent_ed25519_issuer",
    "challenge_path": "/api/v1/authority/leases/sab_lease_beta_challenge/challenges"
  }
}
